{
  "schema_version": 3,
  "operation_id": "v3-slice-20260928-world-set-time",
  "idempotency_key": "v3-slice-20260928/stage-01/set-time",
  "status": "accepted",
  "journal_state": "queued",
  "result": {
    "idempotency_key": "v3-slice-20260928/stage-01/set-time",
    "method": "world.set_time",
    "params_hash": "sha256:c83c61737e3c4399e8591ef939a257e3162619e1bb853be73a51bc5190d4b6e2",
    "journal_state": "queued"
  }
}
